{
  "executionLockSha256": "c91e729ab343ffc652216dbcf9e4b8b3d650a6f1fecb8562dad7f419ba967aed",
  "moves": [
    {
      "evidence": {
        "path": "migration/import-lock.json",
        "sha256": "b56528c2ca715016c71aa26db908c80d4d0337257757f8dc5032ade2b4d87bc5"
      },
      "from": "core/test/typescript3.9",
      "id": "core-typescript-3-9",
      "moveCommit": "9b0e1b9aeed494dd21279b9a70fb6f09a72fe4af",
      "owner": "core/package.json",
      "source": "core",
      "to": "core/integration/typescript-3.9"
    },
    {
      "evidence": {
        "path": "migration/import-lock.json",
        "sha256": "b56528c2ca715016c71aa26db908c80d4d0337257757f8dc5032ade2b4d87bc5"
      },
      "from": "core/test/typescript5.4",
      "id": "core-typescript-5-4",
      "moveCommit": "9b0e1b9aeed494dd21279b9a70fb6f09a72fe4af",
      "owner": "core/package.json",
      "source": "core",
      "to": "core/integration/typescript-5.4"
    },
    {
      "evidence": {
        "path": "migration/import-lock.json",
        "sha256": "b56528c2ca715016c71aa26db908c80d4d0337257757f8dc5032ade2b4d87bc5"
      },
      "from": "plugins/visualizer/example",
      "id": "visualizer-example",
      "moveCommit": "05d111fe0d74272158aafd386d05f6947032470c",
      "owner": "plugins/visualizer/package.json",
      "source": "visualizer",
      "to": "plugins/visualizer/examples/example"
    },
    {
      "evidence": {
        "path": "migration/import-lock.json",
        "sha256": "b56528c2ca715016c71aa26db908c80d4d0337257757f8dc5032ade2b4d87bc5"
      },
      "from": "framework/angularjs/router/test/typescript",
      "id": "angularjs-typescript",
      "moveCommit": "19f9e11477b54d113f1d4bea6c7ae1267dd9020b",
      "owner": "framework/angularjs/router/package.json",
      "source": "angularjs",
      "to": "framework/angularjs/integration/typescript-versions"
    },
    {
      "evidence": {
        "path": "migration/import-lock.json",
        "sha256": "b56528c2ca715016c71aa26db908c80d4d0337257757f8dc5032ade2b4d87bc5"
      },
      "from": "framework/angular/router/test-angular-versions",
      "id": "angular-versions",
      "moveCommit": "cda082bcedf05fb9bc7f708dd87b504cdcce9a1a",
      "owner": "framework/angular/router/package.json",
      "source": "angular",
      "to": "framework/angular/integration/angular-versions"
    },
    {
      "evidence": {
        "path": "migration/import-lock.json",
        "sha256": "b56528c2ca715016c71aa26db908c80d4d0337257757f8dc5032ade2b4d87bc5"
      },
      "from": "framework/angular/router/test-typescript-versions",
      "id": "angular-typescript-versions",
      "moveCommit": "cda082bcedf05fb9bc7f708dd87b504cdcce9a1a",
      "owner": "framework/angular/router/package.json",
      "source": "angular",
      "to": "framework/angular/integration/typescript-versions"
    },
    {
      "evidence": {
        "path": "migration/import-lock.json",
        "sha256": "b56528c2ca715016c71aa26db908c80d4d0337257757f8dc5032ade2b4d87bc5"
      },
      "from": "framework/angular-hybrid/router/example",
      "id": "angular-hybrid-example",
      "moveCommit": "eefa531516da668bfba7d6b992795fb94e5f48c9",
      "owner": "framework/angular-hybrid/router/package.json",
      "source": "angular-hybrid",
      "to": "framework/angular-hybrid/examples/example"
    },
    {
      "evidence": {
        "path": "migration/import-lock.json",
        "sha256": "b56528c2ca715016c71aa26db908c80d4d0337257757f8dc5032ade2b4d87bc5"
      },
      "from": "framework/react/router/examples",
      "id": "react-examples",
      "moveCommit": "80a8ece0478294bffb4a472901c90cc282c88b09",
      "owner": "framework/react/router/package.json",
      "source": "react",
      "to": "framework/react/examples"
    },
    {
      "evidence": {
        "path": "migration/import-lock.json",
        "sha256": "b56528c2ca715016c71aa26db908c80d4d0337257757f8dc5032ade2b4d87bc5"
      },
      "from": "framework/react/router/integration",
      "id": "react-integration",
      "moveCommit": "80a8ece0478294bffb4a472901c90cc282c88b09",
      "owner": "framework/react/router/package.json",
      "source": "react",
      "to": "framework/react/integration"
    },
    {
      "evidence": {
        "path": "migration/import-lock.json",
        "sha256": "b56528c2ca715016c71aa26db908c80d4d0337257757f8dc5032ade2b4d87bc5"
      },
      "from": "framework/react-hybrid/router/integration",
      "id": "react-hybrid-integration",
      "moveCommit": "6eec38d6b3a8ff21b71ab6152e35ff56e7e5a68f",
      "owner": "framework/react-hybrid/router/package.json",
      "source": "react-hybrid",
      "to": "framework/react-hybrid/integration"
    },
    {
      "evidence": {
        "path": "migration/evidence/path-repairs/h03r-layout.json",
        "sha256": "8e2de28dc8d0e86920ba76452424b5bdf19bb8a2e157dbe20d93c44a7f4ad086"
      },
      "from": "framework",
      "id": "frameworks-root",
      "moveCommit": "f45a0e4bf867ad2bed77e4d01ae78444f3f83374",
      "owner": "migration/package-classification.json",
      "source": "monorepo-layout",
      "to": "frameworks"
    },
    {
      "evidence": {
        "path": "migration/evidence/path-repairs/h03r-layout.json",
        "sha256": "8e2de28dc8d0e86920ba76452424b5bdf19bb8a2e157dbe20d93c44a7f4ad086"
      },
      "from": "frameworks/angular/router",
      "id": "angular-package",
      "moveCommit": "f45a0e4bf867ad2bed77e4d01ae78444f3f83374",
      "owner": "frameworks/angular/uirouter-angular/package.json",
      "source": "monorepo-layout",
      "to": "frameworks/angular/uirouter-angular"
    },
    {
      "evidence": {
        "path": "migration/evidence/path-repairs/h03r-layout.json",
        "sha256": "8e2de28dc8d0e86920ba76452424b5bdf19bb8a2e157dbe20d93c44a7f4ad086"
      },
      "from": "frameworks/angularjs/router",
      "id": "angularjs-package",
      "moveCommit": "f45a0e4bf867ad2bed77e4d01ae78444f3f83374",
      "owner": "frameworks/angularjs/uirouter-angularjs/package.json",
      "source": "monorepo-layout",
      "to": "frameworks/angularjs/uirouter-angularjs"
    },
    {
      "evidence": {
        "path": "migration/evidence/path-repairs/h03r-layout.json",
        "sha256": "8e2de28dc8d0e86920ba76452424b5bdf19bb8a2e157dbe20d93c44a7f4ad086"
      },
      "from": "frameworks/angular-hybrid/router",
      "id": "angular-hybrid-package",
      "moveCommit": "f45a0e4bf867ad2bed77e4d01ae78444f3f83374",
      "owner": "frameworks/angular-hybrid/uirouter-angular-hybrid/package.json",
      "source": "monorepo-layout",
      "to": "frameworks/angular-hybrid/uirouter-angular-hybrid"
    },
    {
      "evidence": {
        "path": "migration/evidence/path-repairs/h03r-layout.json",
        "sha256": "8e2de28dc8d0e86920ba76452424b5bdf19bb8a2e157dbe20d93c44a7f4ad086"
      },
      "from": "frameworks/react/router",
      "id": "react-package",
      "moveCommit": "f45a0e4bf867ad2bed77e4d01ae78444f3f83374",
      "owner": "frameworks/react/uirouter-react/package.json",
      "source": "monorepo-layout",
      "to": "frameworks/react/uirouter-react"
    },
    {
      "evidence": {
        "path": "migration/evidence/path-repairs/h03r-layout.json",
        "sha256": "8e2de28dc8d0e86920ba76452424b5bdf19bb8a2e157dbe20d93c44a7f4ad086"
      },
      "from": "frameworks/react-hybrid/router",
      "id": "react-hybrid-package",
      "moveCommit": "f45a0e4bf867ad2bed77e4d01ae78444f3f83374",
      "owner": "frameworks/react-hybrid/uirouter-react-hybrid/package.json",
      "source": "monorepo-layout",
      "to": "frameworks/react-hybrid/uirouter-react-hybrid"
    },
    {
      "evidence": {
        "path": "migration/evidence/path-repairs/h03r-layout.json",
        "sha256": "8e2de28dc8d0e86920ba76452424b5bdf19bb8a2e157dbe20d93c44a7f4ad086"
      },
      "from": "core/integration",
      "id": "core-integration-tests",
      "moveCommit": "f45a0e4bf867ad2bed77e4d01ae78444f3f83374",
      "owner": "core/package.json",
      "source": "monorepo-layout",
      "to": "core/integration-tests"
    },
    {
      "evidence": {
        "path": "migration/evidence/path-repairs/h03r-layout.json",
        "sha256": "8e2de28dc8d0e86920ba76452424b5bdf19bb8a2e157dbe20d93c44a7f4ad086"
      },
      "from": "frameworks/angular/integration",
      "id": "angular-integration-tests",
      "moveCommit": "f45a0e4bf867ad2bed77e4d01ae78444f3f83374",
      "owner": "frameworks/angular/uirouter-angular/package.json",
      "source": "monorepo-layout",
      "to": "frameworks/angular/integration-tests"
    },
    {
      "evidence": {
        "path": "migration/evidence/path-repairs/h03r-layout.json",
        "sha256": "8e2de28dc8d0e86920ba76452424b5bdf19bb8a2e157dbe20d93c44a7f4ad086"
      },
      "from": "frameworks/angularjs/integration",
      "id": "angularjs-integration-tests",
      "moveCommit": "f45a0e4bf867ad2bed77e4d01ae78444f3f83374",
      "owner": "frameworks/angularjs/uirouter-angularjs/package.json",
      "source": "monorepo-layout",
      "to": "frameworks/angularjs/integration-tests"
    },
    {
      "evidence": {
        "path": "migration/evidence/path-repairs/h03r-layout.json",
        "sha256": "8e2de28dc8d0e86920ba76452424b5bdf19bb8a2e157dbe20d93c44a7f4ad086"
      },
      "from": "frameworks/react/integration",
      "id": "react-integration-tests",
      "moveCommit": "f45a0e4bf867ad2bed77e4d01ae78444f3f83374",
      "owner": "frameworks/react/uirouter-react/package.json",
      "source": "monorepo-layout",
      "to": "frameworks/react/integration-tests"
    },
    {
      "evidence": {
        "path": "migration/evidence/path-repairs/h03r-layout.json",
        "sha256": "8e2de28dc8d0e86920ba76452424b5bdf19bb8a2e157dbe20d93c44a7f4ad086"
      },
      "from": "frameworks/react-hybrid/integration",
      "id": "react-hybrid-integration-tests",
      "moveCommit": "f45a0e4bf867ad2bed77e4d01ae78444f3f83374",
      "owner": "frameworks/react-hybrid/uirouter-react-hybrid/package.json",